{
  "schema": "xcodebuildmcp.output.build-result",
  "schemaVersion": "1",
  "didError": false,
  "error": null,
  "data": {
    "request": {
      "scheme": "MCPTest",
      "projectPath": "example_projects/macOS/MCPTest.xcodeproj",
      "configuration": "Debug",
      "platform": "macOS",
      "target": "macos"
    },
    "summary": {
      "status": "SUCCEEDED",
      "durationMs": 1234,
      "target": "macos"
    },
    "artifacts": {
      "bundleId": "io.sentry.MCPTest.macOS",
      "buildLogPath": "<HOME>/Library/Developer/XcodeBuildMCP/logs/build_macos_<TIMESTAMP>_pid<PID>.log"
    },
    "diagnostics": {
      "warnings": [],
      "errors": []
    }
  }
}
