{
  "schema": "xcodebuildmcp.output.build-result",
  "schemaVersion": "1",
  "didError": false,
  "error": null,
  "data": {
    "request": {
      "scheme": "CalculatorApp",
      "workspacePath": "example_projects/iOS_Calculator/CalculatorApp.xcworkspace",
      "configuration": "Debug",
      "platform": "iOS",
      "target": "device"
    },
    "summary": {
      "status": "SUCCEEDED",
      "durationMs": 1234,
      "target": "device"
    },
    "artifacts": {
      "buildLogPath": "<HOME>/Library/Developer/XcodeBuildMCP/logs/build_device_<TIMESTAMP>_pid<PID>.log"
    },
    "diagnostics": {
      "warnings": [],
      "errors": []
    }
  }
}
